{"replay_version": 1, "record": "sha256:0000000000000000000000000000000000000000000000000000000000000000", "op": "rasterize", "step": "mask", "stored_identity": "sha256:0000000000000000000000000000000000000000000000000000000000000000", "rebuilt_identity": "sha256:0000000000000000000000000000000000000000000000000000000000000000", "differing_planes": {"core": 2}, "record_differs": false}
